<?xml version="1.0" encoding="UTF-8"?>
<architectureTypes xsi:noNamespaceSchemaLocation="../src/ch/unibas/cs/hpwc/patus/arch/arch-config.xsd" xmlns:xsi="http://www.w3.org/2001/XMLSchema-instance">
	<!-- Intel x86_64 architecture with SSE, OpenMP parallelization -->
	<architectureType name="Intel x86_64">
		<codegenerator src-suffix="c" backend="OpenMP" use-function-pointers="true"/>
		<parallelism>
			<level number="1" hasExplicitLocalDataCopy="false" asyncIO="false">
				<barrier type="pragma" implementation="omp barrier"/>
			</level>
		</parallelism>
		<datatypes/>
		<declspecs>
			<declspec type="restrictedpointer" specifiers="__restrict__"/>
		</declspecs>
		<intrinsics/>
		<includes>
			<include file="omp.h"/>
		</includes>
		<build compiler-command="make" harness-template-dir="CPU_OpenMP"/>
	</architectureType>

	<architectureType name="Intel x86_64 PAPI" inherits-from="Intel x86_64">
		<build compiler-command="make" harness-template-dir="CPU_OpenMP_PAPI"/>
	</architectureType>

	<!-- Intel x86_64 architecture with SSE, OpenMP parallelization -->
	<architectureType name="Intel x86_64 SSE">
		<codegenerator src-suffix="c" backend="OpenMP" use-function-pointers="true"/>
		<parallelism>
			<level number="1" hasExplicitLocalDataCopy="false" asyncIO="true">
				<barrier type="pragma" implementation="omp barrier"/>
			</level>
		</parallelism>
		<datatypes>
			<!-- declare SSE datatypes -->
			<!-- restrict alignment to 16 bytes -->
			<datatype basetype="float" name="__m128" simdVectorLength="4" width="128" alignment="16"/>
			<datatype basetype="double" name="__m128d" simdVectorLength="2" width="128" alignment="16"/>
		</datatypes>
		<declspecs>
			<declspec type="restrictedpointer" specifiers="__restrict__"/>
		</declspecs>
		<intrinsics>
			<!-- intrinsics for double precision arithmetic operations -->
			<intrinsic baseName="unary_minus" name="neg_pd" datatype="__m128d"/>
			<intrinsic baseName="plus" name="_mm_add_pd" datatype="__m128d"/>
			<intrinsic baseName="minus" name="_mm_sub_pd" datatype="__m128d"/>
			<intrinsic baseName="multiply" name="_mm_mul_pd" datatype="__m128d"/>
			<intrinsic baseName="divide" name="_mm_div_pd" datatype="__m128d"/>
			<intrinsic baseName="sqrt" name="_mm_sqrt_pd" datatype="__m128d"/>
			<intrinsic baseName="min" name="_mm_min_pd" datatype="__m128d"/>
			<intrinsic baseName="max" name="_mm_max_pd" datatype="__m128d"/>
			<!-- ssemathlib.h -->
			<intrinsic baseName="ceil" name="ceil_pd" datatype="__m128d"/>
			<intrinsic baseName="floor" name="floor_pd" datatype="__m128d"/>
			<intrinsic baseName="abs" name="abs_pd" datatype="__m128d"/>
			<intrinsic baseName="exp" name="exp_pd" datatype="__m128d"/>
			<intrinsic baseName="log" name="log_pd" datatype="__m128d"/>
			<intrinsic baseName="log10" name="log10_pd" datatype="__m128d"/>
			<intrinsic baseName="pow" name="pow_pd" datatype="__m128d"/>
			<intrinsic baseName="sin" name="sin_pd" datatype="__m128d"/>
			<intrinsic baseName="cos" name="cos_pd" datatype="__m128d"/>
			<intrinsic baseName="tan" name="tan_pd" datatype="__m128d"/>
			<intrinsic baseName="asin" name="asin_pd" datatype="__m128d"/>
			<intrinsic baseName="acos" name="acos_pd" datatype="__m128d"/>
			<intrinsic baseName="atan" name="atan_pd" datatype="__m128d"/>
			<intrinsic baseName="atan2" name="atan2_pd" datatype="__m128d"/>
			
			<!-- intrinsics for single precision arithmetic operations -->
			<intrinsic baseName="unary_minus" name="neg_ps" datatype="__m128"/>
			<intrinsic baseName="plus" name="_mm_add_ps" datatype="__m128"/>
			<intrinsic baseName="minus" name="_mm_sub_ps" datatype="__m128"/>
			<intrinsic baseName="multiply" name="_mm_mul_ps" datatype="__m128"/>
			<intrinsic baseName="divide" name="_mm_div_ps" datatype="__m128"/>
			<intrinsic baseName="sqrt" name="_mm_sqrt_ps" datatype="__m128"/>
			<intrinsic baseName="min" name="_mm_min_ps" datatype="__m128"/>
			<intrinsic baseName="max" name="_mm_max_ps" datatype="__m128"/>
			<!-- ssemathlib.h -->
			<intrinsic baseName="ceil" name="ceil_ps" datatype="__m128"/>
			<intrinsic baseName="floor" name="floor_ps" datatype="__m128"/>
			<intrinsic baseName="abs" name="abs_ps" datatype="__m128"/>
			<intrinsic baseName="exp" name="exp_ps" datatype="__m128"/>
			<intrinsic baseName="log" name="log_ps" datatype="__m128"/>
			<intrinsic baseName="log10" name="log10_ps" datatype="__m128"/>
			<intrinsic baseName="pow" name="pow_ps" datatype="__m128"/>
			<intrinsic baseName="sin" name="sin_ps" datatype="__m128"/>
			<intrinsic baseName="cos" name="cos_ps" datatype="__m128"/>
			<intrinsic baseName="tan" name="tan_ps" datatype="__m128"/>
			<intrinsic baseName="asin" name="asin_ps" datatype="__m128"/>
			<intrinsic baseName="acos" name="acos_ps" datatype="__m128"/>
			<intrinsic baseName="atan" name="atan_ps" datatype="__m128"/>
			<intrinsic baseName="atan2" name="atan2_ps" datatype="__m128"/>
			
			<!-- non-arithmetic intrinsics -->
		</intrinsics>
		<includes>
			<include file="omp.h"/>
			<include file="xmmintrin.h"/>
			<include file="emmintrin.h"/>
			<include file="ssemathlib.h"/>
		</includes>
		<build compiler-command="make" harness-template-dir="CPU_OpenMP"/>
	</architectureType>

	<!-- Intel x86_64 architecture with SSE, OpenMP parallelization -->
	<architectureType name="Intel x86_64 SSE PAPI" inherits-from="Intel x86_64 SSE">
		<build compiler-command="make" harness-template-dir="CPU_OpenMP_PAPI"/>
	</architectureType>
	
	<!-- Architecture with AVX, OpenMP parallelization -->
	<architectureType name="x86_64 AVX">
		<codegenerator src-suffix="c" backend="OpenMP_AVX" use-function-pointers="true"/>
		<parallelism>
			<level number="1" hasExplicitLocalDataCopy="false" asyncIO="true">
				<barrier type="pragma" implementation="omp barrier"/>
			</level>
		</parallelism>
		<datatypes>
			<!-- declare AVX-256 datatypes -->
			<!-- restrict alignment to 32 bytes -->
			<datatype basetype="float" name="__m256" simdVectorLength="8" width="256" alignment="32"/>
			<datatype basetype="double" name="__m256d" simdVectorLength="4" width="256" alignment="32"/>
		</datatypes>
		<declspecs>
			<declspec type="restrictedpointer" specifiers="__restrict__"/>
		</declspecs>
		<intrinsics>
			<!-- intrinsics for double precision arithmetic operations -->
			<intrinsic baseName="unary_minus" name="neg_pd" datatype="__m256d"/>
			<intrinsic baseName="plus" name="_mm256_add_pd" datatype="__m256d"/>
			<intrinsic baseName="minus" name="_mm256_sub_pd" datatype="__m256d"/>
			<intrinsic baseName="multiply" name="_mm256_mul_pd" datatype="__m256d"/>
			<intrinsic baseName="divide" name="_mm256_div_pd" datatype="__m256d"/>
			<intrinsic baseName="sqrt" name="_mm256_sqrt_pd" datatype="__m256d"/>
			<intrinsic baseName="min" name="_mm256_min_pd" datatype="__m256d"/>
			<intrinsic baseName="max" name="_mm256_max_pd" datatype="__m256d"/>
			
			<!-- intrinsics for single precision arithmetic operations -->
			<intrinsic baseName="unary_minus" name="neg_ps" datatype="__m256"/>
			<intrinsic baseName="plus" name="_mm256_add_ps" datatype="__m256"/>
			<intrinsic baseName="minus" name="_mm256_sub_ps" datatype="__m256"/>
			<intrinsic baseName="multiply" name="_mm256_mul_ps" datatype="__m256"/>
			<intrinsic baseName="divide" name="_mm256_div_ps" datatype="__m256"/>
			<intrinsic baseName="sqrt" name="_mm256_sqrt_ps" datatype="__m256"/>
			<intrinsic baseName="min" name="_mm256_min_ps" datatype="__m256"/>
			<intrinsic baseName="max" name="_mm256_max_ps" datatype="__m256"/>
			
			<!-- non-arithmetic intrinsics -->
		</intrinsics>
		<includes>
			<include file="omp.h"/>
			<include file="immintrin.h"/>
			<include file="x86intrin.h"/>
			<include file="avxmathlib.h"/>
		</includes>
		<build compiler-command="make" harness-template-dir="CPU_OpenMP"/>
	</architectureType>

	<!-- Architecture with AVX+FMA4, OpenMP parallelization -->
	<architectureType name="x86_64 AVX FMA4" inherits-from="x86_64 AVX">
		<datatypes>
			<!-- declare AVX-256 datatypes -->
			<!-- restrict alignment to 32 bytes -->
			<datatype basetype="float" name="__m256" simdVectorLength="8" width="256" alignment="32"/>
			<datatype basetype="double" name="__m256d" simdVectorLength="4" width="256" alignment="32"/>
		</datatypes>
		<intrinsics>
			<!-- intrinsics for double precision arithmetic operations -->
			<intrinsic baseName="unary_minus" name="neg_pd" datatype="__m256d"/>
			<intrinsic baseName="plus" name="_mm256_add_pd" datatype="__m256d"/>
			<intrinsic baseName="minus" name="_mm256_sub_pd" datatype="__m256d"/>
			<intrinsic baseName="multiply" name="_mm256_mul_pd" datatype="__m256d"/>
			<intrinsic baseName="divide" name="_mm256_div_pd" datatype="__m256d"/>
			<intrinsic baseName="sqrt" name="_mm256_sqrt_pd" datatype="__m256d"/>
			<intrinsic baseName="min" name="_mm256_min_pd" datatype="__m256d"/>
			<intrinsic baseName="max" name="_mm256_max_pd" datatype="__m256d"/>
			<intrinsic baseName="fma" name="_mm256_macc_pd" datatype="__m256d" arguments="factor1,factor2,summand"/>
			
			<!-- intrinsics for single precision arithmetic operations -->
			<intrinsic baseName="unary_minus" name="neg_ps" datatype="__m256"/>
			<intrinsic baseName="plus" name="_mm256_add_ps" datatype="__m256"/>
			<intrinsic baseName="minus" name="_mm256_sub_ps" datatype="__m256"/>
			<intrinsic baseName="multiply" name="_mm256_mul_ps" datatype="__m256"/>
			<intrinsic baseName="divide" name="_mm256_div_ps" datatype="__m256"/>
			<intrinsic baseName="sqrt" name="_mm256_sqrt_ps" datatype="__m256"/>
			<intrinsic baseName="min" name="_mm256_min_ps" datatype="__m256"/>
			<intrinsic baseName="max" name="_mm256_max_ps" datatype="__m256"/>
			<intrinsic baseName="fma" name="_mm256_macc_ps" datatype="__m256" arguments="factor1,factor2,summand"/>
		</intrinsics>
	</architectureType>